{
  "schema_version": "l9.effectiveness-outcome/v1",
  "event_id": "ci-observation-100",
  "producer_id": "Quantum-L9/l9-ci-core",
  "producer_contract": "l9.core-rule-outcome/v1",
  "pack_id": "pack_aaaaaaaaaaaaaaaaaaaaaaaaaaaaaaaaaaaaaaaaaaaaaaaaaaaaaaaaaaaaaaaa",
  "pack_version": "1.0.0",
  "canonical_rule_id": "l9.debt.example-rule",
  "surface": "CI",
  "outcome_class": "prevented_before_merge",
  "observation_scope": "run-100",
  "observed_at": "2026-07-17T12:01:00Z",
  "finding_id": "finding-example-100",
  "repository_pseudonym": "repo_0123456789abcdef0123456789abcdef",
  "snapshot_identity": "snapshot-example",
  "document_identity": null,
  "policy_mode": "blocking",
  "latency_ms": 800,
  "effort_minutes": null,
  "limitations": []
}
